"product_name","total_sales"
"Enhanced contextually-based encryption Supplement","10730608.88"
"Balanced tangible moderator Supplement","10588880.16"
"Seamless clear-thinking database Supplement","10308719.81"
"Down-sized optimizing intranet Supplement","10369177.57"
"Organized systemic task-force Supplement","10578889.81"
"Advanced 5thgeneration intranet Supplement","10448563.72"
"Synergistic motivating ability Supplement","10704517.11"
"Robust systemic forecast Supplement","10707739.36"
"Multi-lateral empowering structure Supplement","10624566.36"
"Reverse-engineered asymmetric definition Supplement","10655393.94"
"Advanced tertiary application Supplement","10384794.37"
"Advanced national monitoring Supplement","9905571.53"
"Switchable homogeneous capacity Supplement","10685832.83"
"Organic static product Supplement","10164099.85"
"Customer-focused zero tolerance model Supplement","10458983.38"
"Organic optimizing Graphical User Interface Supplement","10038575.82"
"User-friendly uniform forecast Supplement","10469713.73"
"Secured encompassing hardware Supplement","10446665.33"
"Distributed actuating strategy Supplement","10151289.92"
"Intuitive 24hour frame Supplement","10299331.22"
"Robust cohesive process improvement Supplement","10699414.10"
"Devolved incremental customer loyalty Supplement","11044243.42"
"Focused hybrid access Supplement","10704639.53"
"Optimized fresh-thinking conglomeration Supplement","10484970.01"
"Horizontal secondary complexity Supplement","10648372.95"
"Versatile bifurcated secured line Supplement","11169568.12"
"Horizontal disintermediate solution Supplement","10448243.02"
"Devolved dynamic attitude Supplement","10777433.29"
"Multi-layered empowering superstructure Supplement","10700312.39"
"Customizable fault-tolerant product Supplement","10923909.49"
"Team-oriented 3rdgeneration info-mediaries Supplement","10338727.06"
"Configurable 5thgeneration access Supplement","10338495.89"
"Team-oriented multi-state benchmark Supplement","10534101.88"
"Re-contextualized disintermediate architecture Supplement","10736582.32"
"Organic systemic superstructure Supplement","10671763.44"
"Secured hybrid capacity Supplement","10271402.74"
"Face-to-face mobile solution Supplement","10395433.79"
"Centralized human-resource encryption Supplement","10463071.06"
"Versatile well-modulated algorithm Supplement","10128701.47"
"Automated next generation success Supplement","10801741.17"
"Polarized human-resource Local Area Network Supplement","10637348.65"
"Extended national policy Supplement","10369841.87"
"Team-oriented tertiary access Supplement","10880078.34"
